{
  "app_id": "9f1d2c3b-4a5e-4f60-8b71-2c3d4e5f6a7b",
  "sender_id": "1a2b3c4d-5e6f-4a7b-8c9d-0e1f2a3b4c5d",
  "sender_key": "0f9a1b2c3d4e5f60718293a4b5c6d7e8",
  "connector_id": "kakao_alimtalk_nhn",
  "requested_by": "7c8d9e0f-1a2b-4c3d-8e4f-5a6b7c8d9e0f",
  "requested_at": "2026-09-02T04:05:06.000Z"
}
